Palabra,Pista
Garantizar que todas las actividades se realicen conforme al marco legal vigente.,¿Cuál es el objetivo del cumplimiento normativo en las cooperativas?
80 puntos.,¿Qué puntaje mínimo debe alcanzar un directivo para ser considerado idóneo?
Anualmente o cuando haya cambios en el perfil del evaluado.,¿Cada cuánto debe revisarse la calificación de idoneidad?
Consejo de Vigilancia.,¿Qué órgano puede emitir observaciones ante incumplimientos normativos?
Verificar el cumplimiento de normativas internas y externas.,¿Cuál es el rol del Comité de Cumplimiento?
Matriz de seguimiento normativo.,¿Qué herramienta permite evidenciar el cumplimiento normativo?
